name,amount,price,category_id,description
Silas Bodemeaid,61,50,3,ligula pellentesque ultrices phasellus id sapien in sapien iaculis congue vivamus metus arcu
Hillyer Codman,3,90,4,nonummy integer non velit donec diam neque vestibulum eget vulputate ut ultrices
Estrellita Shaxby,11,14,3,donec posuere metus vitae ipsum aliquam non mauris morbi non lectus aliquam sit
Henderson Ledamun,69,94,4,ut rhoncus aliquet pulvinar sed nisl nunc rhoncus dui vel sem sed sagittis nam congue risus
Meredith Raiman,13,33,4,mi integer ac neque duis bibendum morbi non quam nec dui
Jacintha Feldfisher,51,75,2,in hac habitasse platea dictumst etiam faucibus cursus urna ut tellus nulla ut erat id
Sabina Mollett,97,61,2,mus etiam vel augue vestibulum rutrum rutrum neque aenean auctor gravida sem praesent id massa id
Windy Aguirrezabala,57,80,3,dis parturient montes nascetur ridiculus mus vivamus vestibulum sagittis sapien cum sociis natoque penatibus et magnis
Caresa Ellick,72,87,2,sapien quis libero nullam sit amet turpis elementum ligula vehicula consequat morbi a ipsum
Melania Birkmyre,20,92,4,ut erat curabitur gravida nisi at nibh in hac habitasse platea dictumst aliquam
Ebenezer Monahan,92,90,1,nibh in hac habitasse platea dictumst aliquam augue quam sollicitudin vitae
Florenza Cartan,48,46,3,massa donec dapibus duis at velit eu est congue elementum in hac habitasse
Hy Galbraith,28,8,1,consequat metus sapien ut nunc vestibulum ante ipsum primis in faucibus orci luctus et ultrices posuere cubilia curae mauris
Melita Cescoti,86,46,4,massa donec dapibus duis at velit eu est congue elementum in hac habitasse platea dictumst morbi vestibulum velit id pretium
Dagmar Anstis,68,79,3,lorem vitae mattis nibh ligula nec sem duis aliquam convallis nunc proin at
Rosemaria M'Chirrie,68,65,1,nulla ac enim in tempor turpis nec euismod scelerisque quam turpis adipiscing lorem vitae mattis
Zebulen Guitte,53,17,2,gravida sem praesent id massa id nisl venenatis lacinia aenean sit amet justo morbi ut odio cras mi pede
Elisha Benoit,24,3,1,suspendisse ornare consequat lectus in est risus auctor sed tristique in tempus sit amet sem fusce consequat nulla nisl nunc
Beck McCaughen,66,94,1,non sodales sed tincidunt eu felis fusce posuere felis sed lacus
Waldo Fairleigh,42,49,2,vestibulum quam sapien varius ut blandit non interdum in ante vestibulum
Devlen Trayton,75,78,4,commodo vulputate justo in blandit ultrices enim lorem ipsum dolor sit amet consectetuer adipiscing elit proin interdum mauris non ligula
Prent Blinckhorne,12,14,2,natoque penatibus et magnis dis parturient montes nascetur ridiculus mus vivamus vestibulum sagittis sapien cum
Vania Cutting,63,11,4,malesuada in imperdiet et commodo vulputate justo in blandit ultrices
Tiphani Wooddisse,89,79,2,purus sit amet nulla quisque arcu libero rutrum ac lobortis
Ardyth Owbrick,86,77,3,velit eu est congue elementum in hac habitasse platea dictumst morbi vestibulum velit id pretium iaculis
Electra Caldera,65,42,4,habitasse platea dictumst maecenas ut massa quis augue luctus tincidunt nulla mollis molestie lorem quisque ut erat curabitur gravida
Quintina McLernon,54,17,2,etiam faucibus cursus urna ut tellus nulla ut erat id mauris vulputate elementum nullam varius nulla facilisi cras
Gaspard Shreeve,57,10,2,dis parturient montes nascetur ridiculus mus etiam vel augue vestibulum rutrum rutrum neque
Margo Scoles,93,18,1,eu massa donec dapibus duis at velit eu est congue elementum in hac habitasse platea dictumst morbi vestibulum
Gipsy Hebbs,97,97,4,suscipit ligula in lacus curabitur at ipsum ac tellus semper
